{
  "$schema": "https://json-schema.org/draft/2019-09/schema",
  "$id": "https://github.com/bitol-io/open-observability-results-standard/blob/main/schema/oors-json-schema-latest.json",
  "title": "Open Observability Results Standard (OORS)",
  "description": "A lightweight, tool-agnostic format to exchange data quality and data observability results.",
  "type": "object",
  "additionalProperties": false,
  "required": [
    "apiVersion",
    "kind",
    "id",
    "observedAt",
    "source",
    "results"
  ],
  "properties": {
    "apiVersion": {
      "type": "string",
      "default": "v0.2.2",
      "description": "Version of the OORS schema used. Indicates the version of the standard, e.g., `v0.2.2`."
    },
    "kind": {
      "type": "string",
      "const": "ObservabilityResults",
      "description": "The type of OORS object. For OORS, always `ObservabilityResults`."
    },
    "id": {
      "type": "string",
      "description": "A unique identifier (could be a UUID) identifying the specific observability results."
    },
    "observedAt": {
      "type": "string",
      "format": "date-time",
      "description": "The moment in time when the observations were done (ISO 8601 format)."
    },
    "source": {
      "type": "object",
      "additionalProperties": false,
      "description": "Object describing the source from where the results come (e.g., job, pipeline, etc.).",
      "required": [
        "process"
      ],
      "properties": {
        "process": {
          "type": "string",
          "description": "The name of the process (job, pipeline, etc.) that made the observations."
        },
        "runId": {
          "type": "string",
          "description": "An optional unique identifier for the specific run/execution of the process (e.g., build ID, run ID, etc.)."
        },
        "vendor": {
          "type": "string",
          "description": "An optional field indicating the vendor or tool that produced the observations (e.g., `soda`, `dbt`, `inhouse-build`, etc.)."
        }
      }
    },
    "run": {
      "type": "object",
      "additionalProperties": false,
      "description": "Optional run lifecycle object. When absent, the document is terminal: the authoritative record of a run (pre-v0.2.1 behavior). When present with `state: running`, the document is an interim snapshot of a run still in progress.",
      "required": [
        "state"
      ],
      "properties": {
        "state": {
          "type": "string",
          "enum": [
            "running",
            "completed",
            "aborted"
          ],
          "description": "The lifecycle state of the run this document reports on. `running`: interim snapshot, more documents will follow for this `source.runId`. `completed`: terminal, the run finished and this document is its authoritative record. `aborted`: terminal, the run ended before producing its full results."
        },
        "sequence": {
          "type": "integer",
          "minimum": 0,
          "description": "Optional monotonically increasing ordinal of this document within the run (per `source.runId`). Consumers SHOULD order documents by `sequence` when present, falling back to `observedAt`."
        },
        "progress": {
          "type": "object",
          "additionalProperties": false,
          "required": [
            "current"
          ],
          "description": "Optional progress indicator for the run.",
          "properties": {
            "current": {
              "type": "number",
              "minimum": 0,
              "description": "The amount of progress made so far, e.g., steps completed."
            },
            "total": {
              "type": "number",
              "minimum": 0,
              "description": "Optional total amount expected, e.g., total steps. Omit when unknown."
            },
            "unit": {
              "type": "string",
              "description": "Optional unit of progress, e.g., `steps`, `tables`, `files`, `percent`."
            }
          }
        }
      }
    },
    "contract": {
      "type": "object",
      "additionalProperties": false,
      "description": "Object describing the contract that provided the specifications for the observations. Optional but highly recommended for traceability and context. When provided, all observations in `results` are expected to be based on the specifications defined in that contract.",
      "properties": {
        "contractId": {
          "type": "string",
          "description": "A unique identifier (could be a UUID) identifying the specific contract (ODCS/ODPS) that provided the specifications for the observations."
        },
        "standard": {
          "type": "string",
          "description": "The standard followed by the contract, e.g., `ODCS`, `ODPS`, etc."
        },
        "version": {
          "type": "string",
          "description": "The version of the contract (not the standard), e.g., `1.0.0`, `2.0.0`, etc."
        }
      }
    },
    "results": {
      "type": "array",
      "minItems": 1,
      "description": "An array of results (at least one). Each result object carries the details of a specific observation (check or metric).",
      "items": {
        "$ref": "#/$defs/Result"
      }
    },
    "customProperties": {
      "$ref": "#/$defs/CustomProperties"
    }
  },
  "$defs": {
    "Result": {
      "type": "object",
      "additionalProperties": false,
      "description": "A single result object carrying the details of a specific observation.",
      "required": [
        "id",
        "type",
        "name",
        "status"
      ],
      "properties": {
        "id": {
          "type": "string",
          "description": "A unique identifier for the specific check/metric."
        },
        "type": {
          "type": "string",
          "enum": [
            "check",
            "metric"
          ],
          "description": "The type of observation: `check` (for pass/fail checks) or `metric` (for measured values)."
        },
        "name": {
          "type": "string",
          "description": "A human-readable name for the check/metric."
        },
        "status": {
          "type": "string",
          "enum": [
            "pass",
            "fail"
          ],
          "description": "The outcome of the observation: `pass` or `fail`."
        },
        "relatesTo": {
          "type": "string",
          "description": "Optional reference to the element this result relates to in the linked contract, e.g., a path to a data quality rule or property in the ODCS/ODPS contract referenced by the top-level `contract` object."
        },
        "severity": {
          "type": "string",
          "description": "The severity level of the observation, e.g., `critical`, `high`, `medium`, `low`, `warning`, etc."
        },
        "dimension": {
          "type": "string",
          "description": "The dimension of data quality being observed, e.g., `accuracy`, `completeness`, `consistency`, `timeliness`, `validity`, `uniqueness`, etc. (following ODCS data quality dimensions)."
        },
        "target": {
          "type": "object",
          "additionalProperties": false,
          "description": "Object describing the resource being observed.",
          "properties": {
            "resourceType": {
              "type": "string",
              "description": "The type of resource, e.g., `table`, `column`, `dataset`, etc."
            },
            "resourceIdentifier": {
              "type": [
                "string",
                "array"
              ],
              "items": {
                "type": "string"
              },
              "description": "The identifier(s) of the resource, e.g., table name, column name, etc. May be a single string or an array of strings."
            }
          }
        },
        "measure": {
          "type": "object",
          "additionalProperties": false,
          "description": "Object describing the measurement details.",
          "properties": {
            "metric": {
              "type": "string",
              "description": "The name of the metric being measured, e.g., `rowCount`, `age`, `latency`, etc."
            },
            "value": {
              "type": [
                "number",
                "string"
              ],
              "description": "The observed value of the metric."
            },
            "threshold": {
              "type": "object",
              "description": "Object describing the threshold criteria, e.g., `mustBe`, `mustBeLowerOrEqual`, etc. (following ODCS operator definitions)."
            },
            "unit": {
              "type": "string",
              "description": "The unit of measurement, e.g., `rows`, `seconds`, `percent`, etc."
            }
          }
        },
        "message": {
          "type": "string",
          "description": "A human-readable message providing additional context about the observation."
        },
        "customProperties": {
          "$ref": "#/$defs/CustomProperties"
        }
      }
    },
    "CustomProperties": {
      "type": "array",
      "description": "A list of key/value pairs for custom properties. Shared structure across the Bitol standards.",
      "items": {
        "$ref": "#/$defs/CustomProperty"
      }
    },
    "CustomProperty": {
      "type": "object",
      "additionalProperties": false,
      "required": [
        "property",
        "value"
      ],
      "properties": {
        "property": {
          "type": "string",
          "description": "The name of the key. Names should be in camel case\u2014the same as if they were permanent properties in the standard."
        },
        "value": {
          "description": "The value of the key."
        },
        "description": {
          "type": "string",
          "description": "Optional description of the custom property."
        },
        "id": {
          "type": "string",
          "description": "Optional unique identifier for the custom property, for stable references."
        },
        "vendor": {
          "type": "string",
          "description": "Identifies the vendor, provider, or external system associated with this custom property. SHOULD be a stable, lowercase identifier matching ^[a-z0-9][a-z0-9-]*$ (e.g. confluent, zeenea, atlan, soda). Tools MUST preserve unknown vendor values.",
          "examples": [
            "confluent",
            "zeenea",
            "atlan",
            "soda"
          ]
        }
      }
    }
  },
  "if": {
    "type": "object",
    "properties": {
      "run": {
        "type": "object",
        "properties": {
          "state": {
            "const": "running"
          }
        },
        "required": [
          "state"
        ]
      }
    },
    "required": [
      "run"
    ]
  },
  "then": {
    "type": "object",
    "properties": {
      "source": {
        "type": "object",
        "required": [
          "process",
          "runId"
        ]
      }
    }
  }
}
