{
  "apiVersion": "v0.2.0",
  "kind": "ObservabilityResults",
  "id": "5a7e2c91-4d3b-4f8a-b6c5-1e0d9f2a8b34",
  "observedAt": "2026-07-13T09:30:00Z",
  "source": {
    "process": "nightly-quality-suite",
    "runId": "${CI_PIPELINE_RUN_ID}"
  },
  "results": [
    {
      "id": "no_dup_rows",
      "type": "check",
      "name": "No duplicate rows",
      "status": "pass",
      "target": {
        "resourceType": "table",
        "resourceIdentifier": "${DB_SCHEMA:-public}.orders"
      }
    }
  ]
}
